[
 {
  "id": "sfx.mixkit.whoosh-light-03",
  "type": "sfx",
  "title": "Flying fast swoosh",
  "tags": [
   "transition",
   "swipe",
   "whoosh"
  ],
  "energy": [
   "light"
  ],
  "phase": [
   "setup",
   "build"
  ],
  "path": "audio/sfx/whoosh/whoosh-light-03.wav",
  "duration_s": 0.945,
  "format": "wav",
  "stored": "git",
  "source": "Mixkit (mixkit.co)",
  "source_url": "https://mixkit.co/free-sound-effects/swoosh/",
  "license": "Mixkit-SFX-Free",
  "license_url": "https://mixkit.co/license/#sfxFree",
  "commercial_ok": true,
  "redistribution": "no-standalone",
  "quality": "A",
  "quality_note": "automated check only (ffmpeg astats + numpy: no clipping, peak -1 dBFS, tail/noise floor, bandwidth; spectrogram for whooshes)",
  "cost_usd": 0,
  "note": "Mixkit SFX id 1469 (\"Flying fast swoosh\"), 128 kbps mp3 preview source",
  "added": "2026-10-30",
  "size_bytes": 181484,
  "how_made": "audio/tools/process_sfx.py (manifest sfx_manifest.py): decode -> 48 kHz stereo -> DC remove -> trim silence < -55 dBFS -> peak -1 dBFS -> fade -> PCM16 WAV",
  "reuse": "<Audio src={staticFile('audio/sfx/whoosh/whoosh-light-03.wav')}/> at 0.4-0.7 volume; transition, swipe, whoosh"
 },
 {
  "id": "sfx.mixkit.whoosh-medium-02",
  "type": "sfx",
  "title": "Cinematic whoosh fast transition",
  "tags": [
   "scene-transition",
   "wipe",
   "whoosh"
  ],
  "energy": [
   "medium"
  ],
  "phase": [
   "setup",
   "build"
  ],
  "path": "audio/sfx/whoosh/whoosh-medium-02.wav",
  "duration_s": 1.3,
  "format": "wav",
  "stored": "git",
  "source": "Mixkit (mixkit.co)",
  "source_url": "https://mixkit.co/free-sound-effects/whoosh/",
  "license": "Mixkit-SFX-Free",
  "license_url": "https://mixkit.co/license/#sfxFree",
  "commercial_ok": true,
  "redistribution": "no-standalone",
  "quality": "A",
  "quality_note": "automated check only (ffmpeg astats + numpy: no clipping, peak -1 dBFS, tail/noise floor, bandwidth; spectrogram for whooshes)",
  "cost_usd": 0,
  "note": "Mixkit SFX id 1492 (\"Cinematic whoosh fast transition\"), 128 kbps mp3 preview source",
  "added": "2026-10-30",
  "size_bytes": 249644,
  "how_made": "audio/tools/process_sfx.py (manifest sfx_manifest.py): decode -> 48 kHz stereo -> DC remove -> trim silence < -55 dBFS -> peak -1 dBFS -> fade -> PCM16 WAV",
  "reuse": "<Audio src={staticFile('audio/sfx/whoosh/whoosh-medium-02.wav')}/> at 0.4-0.7 volume; scene-transition, wipe, whoosh"
 },
 {
  "id": "sfx.mixkit.whoosh-medium-03",
  "type": "sfx",
  "title": "Fast air sweep transition",
  "tags": [
   "scene-transition",
   "wipe",
   "whoosh"
  ],
  "energy": [
   "medium"
  ],
  "phase": [
   "setup",
   "build"
  ],
  "path": "audio/sfx/whoosh/whoosh-medium-03.wav",
  "duration_s": 0.775,
  "format": "wav",
  "stored": "git",
  "source": "Mixkit (mixkit.co)",
  "source_url": "https://mixkit.co/free-sound-effects/swoosh/",
  "license": "Mixkit-SFX-Free",
  "license_url": "https://mixkit.co/license/#sfxFree",
  "commercial_ok": true,
  "redistribution": "no-standalone",
  "quality": "A",
  "quality_note": "automated check only (ffmpeg astats + numpy: no clipping, peak -1 dBFS, tail/noise floor, bandwidth; spectrogram for whooshes)",
  "cost_usd": 0,
  "note": "Mixkit SFX id 168 (\"Fast air sweep transition\"), 128 kbps mp3 preview source",
  "added": "2026-10-30",
  "size_bytes": 148844,
  "how_made": "audio/tools/process_sfx.py (manifest sfx_manifest.py): decode -> 48 kHz stereo -> DC remove -> trim silence < -55 dBFS -> peak -1 dBFS -> fade -> PCM16 WAV",
  "reuse": "<Audio src={staticFile('audio/sfx/whoosh/whoosh-medium-03.wav')}/> at 0.4-0.7 volume; scene-transition, wipe, whoosh"
 },
 {
  "id": "sfx.mixkit.whoosh-heavy-03",
  "type": "sfx",
  "title": "Movie whoosh impact",
  "tags": [
   "title-reveal",
   "hit",
   "whoosh"
  ],
  "energy": [
   "heavy"
  ],
  "phase": [
   "build",
   "climax"
  ],
  "path": "audio/sfx/whoosh/whoosh-heavy-03.wav",
  "duration_s": 3.24,
  "format": "wav",
  "stored": "git",
  "source": "Mixkit (mixkit.co)",
  "source_url": "https://mixkit.co/free-sound-effects/whoosh/",
  "license": "Mixkit-SFX-Free",
  "license_url": "https://mixkit.co/license/#sfxFree",
  "commercial_ok": true,
  "redistribution": "no-standalone",
  "quality": "A",
  "quality_note": "automated check only (ffmpeg astats + numpy: no clipping, peak -1 dBFS, tail/noise floor, bandwidth; spectrogram for whooshes)",
  "cost_usd": 0,
  "note": "Mixkit SFX id 2903 (\"Movie whoosh impact\"), 128 kbps mp3 preview source",
  "added": "2026-10-30",
  "size_bytes": 622124,
  "how_made": "audio/tools/process_sfx.py (manifest sfx_manifest.py): decode -> 48 kHz stereo -> DC remove -> trim silence < -55 dBFS -> peak -1 dBFS -> fade -> PCM16 WAV",
  "reuse": "<Audio src={staticFile('audio/sfx/whoosh/whoosh-heavy-03.wav')}/> at 0.4-0.7 volume; title-reveal, hit, whoosh"
 },
 {
  "id": "sfx.mixkit.pop-01",
  "type": "sfx",
  "title": "Long pop",
  "tags": [
   "element-in",
   "bubble",
   "ui",
   "pop"
  ],
  "energy": [
   "light"
  ],
  "phase": [
   "hook",
   "setup"
  ],
  "path": "audio/sfx/pop/pop-01.wav",
  "duration_s": 0.46,
  "format": "wav",
  "stored": "git",
  "source": "Mixkit (mixkit.co)",
  "source_url": "https://mixkit.co/free-sound-effects/pop/",
  "license": "Mixkit-SFX-Free",
  "license_url": "https://mixkit.co/license/#sfxFree",
  "commercial_ok": true,
  "redistribution": "no-standalone",
  "quality": "A",
  "quality_note": "automated check only (ffmpeg astats + numpy: no clipping, peak -1 dBFS, tail/noise floor, bandwidth; spectrogram for whooshes)",
  "cost_usd": 0,
  "note": "Mixkit SFX id 2358 (\"Long pop\"), 128 kbps mp3 preview source",
  "added": "2026-10-30",
  "size_bytes": 88364,
  "how_made": "audio/tools/process_sfx.py (manifest sfx_manifest.py): decode -> 48 kHz stereo -> DC remove -> trim silence < -55 dBFS -> peak -1 dBFS -> fade -> PCM16 WAV",
  "reuse": "<Audio src={staticFile('audio/sfx/pop/pop-01.wav')}/> at 0.4-0.7 volume; element-in, bubble, ui"
 },
 {
  "id": "sfx.mixkit.pop-02",
  "type": "sfx",
  "title": "Dry pop up",
  "tags": [
   "element-in",
   "ui",
   "pop"
  ],
  "energy": [
   "light"
  ],
  "phase": [
   "hook",
   "setup"
  ],
  "path": "audio/sfx/pop/pop-02.wav",
  "duration_s": 0.3,
  "format": "wav",
  "stored": "git",
  "source": "Mixkit (mixkit.co)",
  "source_url": "https://mixkit.co/free-sound-effects/pop/",
  "license": "Mixkit-SFX-Free",
  "license_url": "https://mixkit.co/license/#sfxFree",
  "commercial_ok": true,
  "redistribution": "no-standalone",
  "quality": "A",
  "quality_note": "automated check only (ffmpeg astats + numpy: no clipping, peak -1 dBFS, tail/noise floor, bandwidth; spectrogram for whooshes)",
  "cost_usd": 0,
  "note": "Mixkit SFX id 2356 (\"Dry pop up\"), 128 kbps mp3 preview source",
  "added": "2026-10-30",
  "size_bytes": 28844,
  "how_made": "audio/tools/process_sfx.py (manifest sfx_manifest.py): decode -> 48 kHz mono -> DC remove -> trim silence < -55 dBFS -> peak -1 dBFS -> fade -> PCM16 WAV",
  "reuse": "<Audio src={staticFile('audio/sfx/pop/pop-02.wav')}/> at 0.4-0.7 volume; element-in, ui, pop"
 },
 {
  "id": "sfx.mixkit.pop-03",
  "type": "sfx",
  "title": "Bubble pop up",
  "tags": [
   "element-in",
   "bubble",
   "pop"
  ],
  "energy": [
   "light"
  ],
  "phase": [
   "hook",
   "setup"
  ],
  "path": "audio/sfx/pop/pop-03.wav",
  "duration_s": 0.35,
  "format": "wav",
  "stored": "git",
  "source": "Mixkit (mixkit.co)",
  "source_url": "https://mixkit.co/free-sound-effects/pop/",
  "license": "Mixkit-SFX-Free",
  "license_url": "https://mixkit.co/license/#sfxFree",
  "commercial_ok": true,
  "redistribution": "no-standalone",
  "quality": "A",
  "quality_note": "automated check only (ffmpeg astats + numpy: no clipping, peak -1 dBFS, tail/noise floor, bandwidth; spectrogram for whooshes)",
  "cost_usd": 0,
  "note": "Mixkit SFX id 2357 (\"Bubble pop up\"), 128 kbps mp3 preview source",
  "added": "2026-10-30",
  "size_bytes": 33644,
  "how_made": "audio/tools/process_sfx.py (manifest sfx_manifest.py): decode -> 48 kHz mono -> DC remove -> trim silence < -55 dBFS -> peak -1 dBFS -> fade -> PCM16 WAV",
  "reuse": "<Audio src={staticFile('audio/sfx/pop/pop-03.wav')}/> at 0.4-0.7 volume; element-in, bubble, pop"
 },
 {
  "id": "sfx.mixkit.click-02",
  "type": "sfx",
  "title": "Cool interface click tone",
  "tags": [
   "ui",
   "button",
   "click"
  ],
  "energy": [
   "light"
  ],
  "phase": [
   "setup"
  ],
  "path": "audio/sfx/click/click-02.wav",
  "duration_s": 0.065,
  "format": "wav",
  "stored": "git",
  "source": "Mixkit (mixkit.co)",
  "source_url": "https://mixkit.co/free-sound-effects/click/",
  "license": "Mixkit-SFX-Free",
  "license_url": "https://mixkit.co/license/#sfxFree",
  "commercial_ok": true,
  "redistribution": "no-standalone",
  "quality": "A",
  "quality_note": "automated check only (ffmpeg astats + numpy: no clipping, peak -1 dBFS, tail/noise floor, bandwidth; spectrogram for whooshes)",
  "cost_usd": 0,
  "note": "Mixkit SFX id 2568 (\"Cool interface click tone\"), 128 kbps mp3 preview source",
  "added": "2026-10-30",
  "size_bytes": 12524,
  "how_made": "audio/tools/process_sfx.py (manifest sfx_manifest.py): decode -> 48 kHz stereo -> DC remove -> trim silence < -55 dBFS -> peak -1 dBFS -> fade -> PCM16 WAV",
  "reuse": "<Audio src={staticFile('audio/sfx/click/click-02.wav')}/> at 0.4-0.7 volume; ui, button, click"
 },
 {
  "id": "sfx.mixkit.click-03",
  "type": "sfx",
  "title": "Clear mouse clicks",
  "tags": [
   "ui",
   "mouse",
   "click"
  ],
  "energy": [
   "light"
  ],
  "phase": [
   "setup"
  ],
  "path": "audio/sfx/click/click-03.wav",
  "duration_s": 0.23,
  "format": "wav",
  "stored": "git",
  "source": "Mixkit (mixkit.co)",
  "source_url": "https://mixkit.co/free-sound-effects/click/",
  "license": "Mixkit-SFX-Free",
  "license_url": "https://mixkit.co/license/#sfxFree",
  "commercial_ok": true,
  "redistribution": "no-standalone",
  "quality": "A",